,index,date,name,title_text,content_text,date_b,condor,guarda,disparo,matou,morto,mortos,morte,morreu,feriu,bala,fatal,não letal,não-letal,não letais,não-letais
125,35,18/04/2023 18h13,Fantástico,"Airsoft: arma usada em curso de tiro para crianças não é letal,...","As esferas de PVC atingem velocidades de 50 a 200 metros por segundo. Não são consideradas letais, mas podem machucar e até cegar... — ... uma pessoa. “Me chocou ver crianças apontando armas muito parecidas com armas reais"", diz conselheiro do Fórum Brasileiro de Segurança Pública....",2023-04-18 18:13:00.000000,0.0,0.0,0.0,0.0,0.0,0.0,0.0,0.0,0.0,0.0,0.0,0.0,0.0,0.0,0.0
126,56,16/03/2023 07h26,globoesporte.com,Análise: Botafogo é letal e usa bem a bola parada como arma; ve...,"A dramaticidade da classificação frente ao Sergipe deu lugar a uma avalanche de gols do Botafogo na goleada por 7 a 1 sobre o Brasiliense, quarta-feira, no Espírito Santo. Missão cumprida, com motivos para comemorar, mas ainda muitas coisas que ainda podem mel...",2023-03-16 07:26:00.000000,0.0,0.0,0.0,0.0,0.0,0.0,0.0,0.0,0.0,0.0,0.0,0.0,0.0,0.0,0.0
127,55,23/01/2023 20h11,MTTV 2ª Edição - Cuiabá,Família contesta versão da PM sobre morte de homem que usava ar...,Família contesta versão da PM sobre morte de homem que usava arma não letal em Sinop,2023-01-23 20:11:00.000000,0.0,0.0,0.0,0.0,0.0,0.0,1.0,0.0,0.0,0.0,0.0,1.0,0.0,0.0,0.0
128,18,16/12/2022 15h26,G1,PM implementa novas estratégias para 2023: equipes deverão usar...,"... portar armamentos não-letais no policiamento de rua, além das armas convencionais.
De acordo com o secretário, tal medida só será... — ... (de pimenta), armas de choque e munições de elastano (borracha) — que serão distribuídos estrategicamente entre todas as unidades operacionais da Secretaria de Estado da Polícia Militar. ...",2022-12-16 15:26:00.000000,0.0,0.0,0.0,0.0,0.0,0.0,0.0,0.0,0.0,0.0,0.0,0.0,0.0,0.0,1.0
129,46,20/10/2022 13h36,epocanegocios,"Polícia de Oakland, nos EUA, estuda usar robôs com armas letais","..., com exceção da distribuição de spray de pimenta. “Não iremos armar robôs com munições letais tão cedo”, afirmou Daza-Quiroz... — ... de Oakland, nos Estados Unidos, tem planejado o lançamento de máquinas equipadas com munições letais em certas ocorrências. A revelação...",2022-10-20 13:36:00.000000,0.0,0.0,0.0,0.0,0.0,0.0,0.0,0.0,0.0,0.0,0.0,0.0,0.0,0.0,0.0
130,16,15/09/2022 10h26,Marie Claire,Soraya Thronicke propõe 'armas não letais para as mulheres se d...,"... a autodefesa armada'
	

	 

	Soraya propõe a ampliação da rede Casa da Mulher Brasileira, distribuição de armas não letais e aulas... — ... disso e tenho um projeto de lei que propõe armas não letais para as mulheres poderem se defender. Também tem o projeto de lei...",2022-09-15 10:26:00.000000,0.0,0.0,0.0,0.0,0.0,0.0,0.0,0.0,0.0,0.0,0.0,0.0,0.0,1.0,0.0
131,133,26/07/2022 12h27,globoesporte.com,Fluminense pede à PM posicionamento sobre relatos de agressões ...,"... que vai verificar a ocorrência.
Alguns vídeos publicados mostram policiais atirando com armas não-letais e spray de pimenta em direção...",2022-07-26 12:27:00.000000,0.0,0.0,0.0,0.0,0.0,0.0,0.0,0.0,0.0,0.0,0.0,0.0,0.0,0.0,1.0
132,27,14/06/2022 16h29,G1,Após homem esquizofrênico ser morto a tiros por guarda durante ...,"...) que possui apenas quatro armas não letais, de choque, para os 122 agentes que a cidade possui atualmente. Segundo a família de Bruno... — ... atendida a tempo de o homem começar a atacar.
""A Corporação possui armas não letais, porém, o número não é suficiente para equipar...",2022-06-14 16:29:00.000000,0.0,0.0,0.0,0.0,0.0,0.0,0.0,0.0,0.0,0.0,0.0,0.0,0.0,1.0,0.0
133,146,14/06/2022 12h28,Jornal da EPTV 1ª Edição - Campinas/Piracicaba,Família de jovem morto baleado por guarda municipal de Vinhedo ...,GM alegou que não tem armas não letais para todas as equipes.,2022-06-14 12:28:00.000000,0.0,0.0,0.0,0.0,0.0,0.0,0.0,0.0,0.0,0.0,0.0,0.0,0.0,1.0,0.0
134,83,25/05/2022 10h47,Época Negócios,Ataque mais letal em escola dos EUA em quase uma década leva Bi...,"... tiroteio mais letal nos Estados Unidos em quase uma década, levando o presidente dos EUA, Joe Biden, a pedir aos norte-americanos... — ... que enfrentem o lobby de armas do país e pressionem o Congresso a endurecer as leis sobre armas.

	+ Papa lamenta massacre no...",2022-05-25 10:47:00.000000,0.0,0.0,0.0,0.0,0.0,0.0,0.0,0.0,0.0,0.0,0.0,0.0,0.0,0.0,0.0
135,81,07/03/2022 08h50,Bom Dia Cidade – Sul de Minas,Guarda Municipal de Varginha recebe armas letais e de borracha ...,Guarda Municipal de Varginha recebe armas letais e de borracha após treinamentos,2022-03-07 08:50:00.000000,0.0,1.0,0.0,0.0,0.0,0.0,0.0,0.0,0.0,0.0,0.0,0.0,0.0,0.0,0.0
136,66,19/11/2021 00h03,G1,4 inventores que criaram armas super-letais e se arrependeram,"... sem avaliar o poder destrutivo das suas criações, acabaram por dar origem a algumas das armas mais letais da história.
Compartilhe... — ... que estivesse criando algo que poderia ser utilizado como arma: o agente laranja.
Sua área de estudo se concentrava nos hormônios...",2021-11-19 00:03:00.000000,0.0,0.0,0.0,0.0,0.0,0.0,0.0,0.0,0.0,0.0,0.0,0.0,0.0,0.0,0.0
137,94,22/10/2021 16h18,Globo Esporte PB,Cruz das Armas é letal e vence Valentina pela Copa João Pessoa ...,Resultado final foi de 1 a 0 para o Cruz das Armas,2021-10-22 16:18:00.000000,0.0,0.0,0.0,0.0,0.0,0.0,0.0,0.0,0.0,0.0,0.0,0.0,0.0,0.0,0.0
138,127,15/09/2021 08h20,Bom Dia Paraná,Guarda Municipal afirmou no B.O. que trocou a munição da arma p...,"Um jovem de 22 anos morreu baleado, e outras duas pessoas ficaram feridas durante uma abordagem da Guarda Municipal de Curitiba, no sábado (11)",2021-09-15 08:20:00.000000,0.0,1.0,0.0,0.0,0.0,0.0,0.0,1.0,0.0,0.0,0.0,0.0,0.0,0.0,0.0
139,84,02/08/2021 11h14,G1 RS,Aglomeração na Orla do Guaíba é dispersada com arma não-letal,Grupo de pessoas que já tem histórico de brigas era monitorado pela Guarda Municipal.,2021-08-02 11:14:00.000000,0.0,1.0,0.0,0.0,0.0,0.0,0.0,0.0,0.0,0.0,0.0,0.0,0.0,0.0,0.0
140,122,16/06/2021 23h40,G1,Policial penal confessa uso de arma letal em troca de tiros que...,"... confessou em depoimento ter utilizado uma arma letal durante a troca de tiros que deixou uma pessoa morta na Penitenciária José Edson... — ... não letais, contudo, um projétil foi encontrado no crânio da vítima e o mesmo era de arma de fogo.
""Acabou que um agente...",2021-06-16 23:40:00.000000,0.0,0.0,0.0,0.0,0.0,0.0,0.0,0.0,0.0,0.0,0.0,0.0,0.0,1.0,0.0
141,109,16/06/2021 19h56,MGTV 2ª Edição – Zona da Mata,Arma letal foi usada em troca de tiros em frente a penitenciári...,O caso aconteceu em maio e resultou na morte uma pessoa. Agentes penitenciários prestaram depoimento na terça-feira (15) e informações mudaram o rumo das investigações.,2021-06-16 19:56:00.000000,0.0,0.0,0.0,0.0,0.0,0.0,1.0,0.0,0.0,0.0,0.0,0.0,0.0,0.0,0.0
142,28,07/06/2021 14h45,G1 PE,Armas não letais: como devem ser utilizadas para não causar fer...,"O Fantástico foi até o centro de treinamento de umas das maiores fornecedoras de armas não letais do mundo, que fornece balas...",2021-06-07 14:45:00.000000,0.0,0.0,0.0,0.0,0.0,0.0,0.0,0.0,0.0,1.0,0.0,0.0,0.0,1.0,0.0
143,59,28/03/2021 00h05,blogs,Guarda legal sem arma letal,"... de desrespeitos à coletividade, sem necessidade do “argumento” letal da arma mortal.
Alguns guardas aspiram ao porte de arma de fogo... — ... vez menos nítida a linha que separa a arma legal da ilegal. A prefeitura mencionou a milícia entre os setores a serem combatidos...",2021-03-28 00:05:00.000000,0.0,1.0,0.0,0.0,0.0,0.0,0.0,0.0,0.0,0.0,0.0,0.0,0.0,0.0,0.0
144,144,12/10/2020 16h38,G1,"Evolução do coronavírus: o que é a mutagênese letal, possível a...","...
'Potencial'
Perguntamos a Esteban Domingo e Armando Arias se eles acreditam que a mutagênese letal pode ser uma arma importante no... — ... começo da doença"", disse Arias.
A dúvida sobre a Covid-19
A grande questão é se medicamentos que causam mutagênese letal poderiam ser...",2020-10-12 16:38:00.000000,0.0,0.0,0.0,0.0,0.0,0.0,0.0,0.0,0.0,0.0,0.0,0.0,0.0,0.0,0.0
145,141,05/10/2020 19h23,G1,Polícia apreende em Fortaleza arma com poder letal feita de can...,"... de fogo artesanal com poder letal abandonada no Bairro Dom Lustosa, em Fortaleza.
A arma é feita de canos de ferro e, à primeira... — Arma artesanal apreendida chama atenção de policiais militares em Fortaleza
A polícia militar apreendeu neste domingo uma arma...",2020-10-05 19:23:00.000000,0.0,0.0,0.0,0.0,0.0,0.0,0.0,0.0,0.0,0.0,0.0,0.0,0.0,0.0,0.0
146,39,11/08/2020 10h35,Bom Dia ES,"Armas não letais são usadas no combate a crimes, no ES",Pistola de choque e spray de pimenta são as mais comuns.,2020-08-11 10:35:00.000000,0.0,0.0,0.0,0.0,0.0,0.0,0.0,0.0,0.0,0.0,0.0,0.0,0.0,0.0,0.0
147,37,18/07/2020 01h00,RJ Inter TV 2ª Edição *Campos dos Goytacazes (Inter TV Planície),Policiais participam de atividade para manusear armas não letai...,Ação foi nesta quinta-feira (3).,2020-07-18 01:00:00.000000,0.0,0.0,0.0,0.0,0.0,0.0,0.0,0.0,0.0,0.0,0.0,0.0,0.0,0.0,0.0
148,50,17/01/2020 16h35,G1,Guarda Municipal recebe verba para compra de baterias de armas ...,"... nesta sexta-feira (17). Segundo a pasta, foram 35 novas baterias compradas com a verba. 
O uso da arma não letal foi autorizado... — A arma spark, que imobiliza o indivíduo, está entre os itens que serão utilizados pela guarda municipal de Juiz de Fora
Luís...",2020-01-17 16:35:00.000000,0.0,1.0,0.0,0.0,0.0,0.0,0.0,0.0,0.0,0.0,0.0,1.0,0.0,0.0,0.0
149,41,16/07/2019 19h45,DF2,Policiais rodoviários federais recebem treinamento de armas não...,Trinta policiais participaram do curso. O objetivo é atualizar as técnicas de uso de instrumentos de menor potencial ofensivo.,2019-07-16 19:45:00.000000,0.0,0.0,0.0,0.0,0.0,0.0,0.0,0.0,0.0,0.0,0.0,0.0,0.0,0.0,0.0
